{"act_version":"0.1","root":"wp/category/announcements","depth":3,"truncated":false,"tokens":{"body":0,"summary":5},"nodes":[{"act_version":"0.1","id":"wp/category/announcements","type":"section","title":"Announcements","etag":"s256:48ZZ5D1_JrDM6iO4CSsI3h","summary":"Release notes and project updates.","summary_source":"author","content":[],"tokens":{"summary":5},"metadata":{"source":{"adapter":"act-wordpress","source_id":"https://blog.example#category:10"},"wp_post_count":2}}],"etag":"s256:Er07pxP5AKp02dxB3XiN7A"}