{"act_version":"0.1","root":"cms/en-us/landing/dpa","depth":3,"truncated":false,"tokens":{"body":7,"summary":6},"nodes":[{"act_version":"0.1","id":"cms/en-us/landing/dpa","type":"landing","title":"Data Processing Addendum","etag":"s256:yyQxEWxilNO4ywrrBzEcFC","summary":"Acme's data-processing terms for enterprise customers.","summary_source":"author","content":[{"type":"prose","format":"plain","text":"This addendum supplements the master services agreement."},{"type":"marketing:hero","headline":"Data Processing Addendum","subhead":"For enterprise customers.","metadata":{"extracted_via":"component-contract","extraction_method":"ssr-walk"}}],"tokens":{"summary":6,"body":7},"metadata":{"locale":"en-US","translations":[{"locale":"es-ES","id":"cms/es-es/landing/dpa"},{"locale":"de-DE","id":"cms/de-de/landing/dpa"},{"locale":"ja-JP","id":"cms/ja-jp/landing/dpa"}],"source":{"adapter":"act-contentful","source_id":"acme-marketing/master/d001@en-US","contributors":["act-contentful","act-react-extract","act-i18n"]}},"source":{"human_url":"https://acme.example.com/en-US/landing/dpa"}}],"etag":"s256:WLCXTwvRhh8Qt1AVKkF7UE"}