{"act_version":"0.1","root":"cms/ja-jp/landing/features","depth":3,"truncated":false,"tokens":{"body":12,"summary":2},"nodes":[{"act_version":"0.1","id":"cms/ja-jp/landing/features","type":"landing","title":"機能","etag":"s256:7Thycnbi5zgkTFNtK0r27b","summary":"ACT で構築するために必要なすべて。","summary_source":"author","content":[{"type":"prose","format":"plain","text":"From source adapters to runtime SDKs, ACT covers the full producer surface."},{"type":"marketing:hero","headline":"Everything you need","subhead":"A spec, adapters, generators, and runtime SDKs.","metadata":{"extracted_via":"component-contract","extraction_method":"ssr-walk"}},{"type":"marketing:feature-grid","features":[{"title":"Source adapters","description":"Markdown, Contentful, Sanity, i18n…"},{"title":"Generators","description":"Astro, Next.js, Eleventy, Docusaurus…"},{"title":"Runtime SDKs","description":"Express, Fastify, Next.js (runtime)…"},{"title":"Validator","description":"Conformance reporter with gap detection."}],"metadata":{"extracted_via":"component-contract","extraction_method":"ssr-walk"}},{"type":"marketing:cta","headline":"Browse all packages","actions":[{"text":"View on npm","to":"https://npmjs.com"}],"metadata":{"extracted_via":"component-contract","extraction_method":"ssr-walk"}}],"tokens":{"summary":2,"body":12},"metadata":{"locale":"ja-JP","translations":[{"locale":"en-US","id":"cms/en-us/landing/features"},{"locale":"es-ES","id":"cms/es-es/landing/features"},{"locale":"de-DE","id":"cms/de-de/landing/features"}],"source":{"adapter":"act-contentful","source_id":"ja-JP:landing/features","contributors":["act-contentful","act-react-extract","act-i18n"]},"translation_status":"complete"},"source":{"human_url":"https://acme.example.com/ja-JP/landing/features"}}],"etag":"s256:ejuNsBpBgUHVx6M3Xe2MPT"}