{"act_version":"0.1","root":"wp/post/wiring-the-wordpress-adapter","depth":3,"truncated":false,"tokens":{"body":75,"summary":14},"nodes":[{"act_version":"0.1","id":"wp/post/wiring-the-wordpress-adapter","type":"article","title":"Wiring the WordPress adapter","etag":"s256:a9xhPBj-k6ieP9CpcLmAo8","summary":"How the adapter talks to wp/v2/{posts,pages,categories,tags,users} and turns each row into one ACT node.","summary_source":"author","content":[{"type":"prose","format":"plain","text":"The adapter's enumerate step pulls every collection you opt into via config.include and yields raw WordPress rows. transform then maps each row to one ACT node: titles become title, the rendered HTML becomes a prose block, and the rendered excerpt becomes the node's summary."},{"type":"prose","format":"plain","text":"Categories and tags are emitted as branch nodes so the tree has structure — posts hang off their primary category. Pages keep their parent relationship intact, mirroring the WordPress page hierarchy."}],"tokens":{"summary":14,"body":75},"tags":["category:11","tag:21"],"metadata":{"source":{"adapter":"act-wordpress","source_id":"https://blog.example#post:103","source_path":"https://blog.example/wiring-the-wordpress-adapter/"},"modified_at":"2026-04-16T10:15:00","wp_author_id":1}}],"etag":"s256:TpmJoTDI5VHW_lO7YNf6qc"}