{"act_version":"0.1","root":"changelog","depth":3,"truncated":false,"tokens":{"body":22,"summary":8},"nodes":[{"act_version":"0.1","id":"changelog","type":"reference","title":"Changelog","summary":"Release notes for the Tinybox SDK reference docs.","summary_source":"author","content":[{"type":"prose","format":"markdown","text":"## v0.1 — 2026-05-02\n\n- Initial public release.\n- Buckets, Objects, and Webhooks API surfaces.\n- 100+ recipes and 60+ troubleshooting entries."}],"tokens":{"summary":8,"body":22},"metadata":{"source":{"adapter":"act-markdown","source_id":"changelog.md","source_path":"changelog.md"}},"etag":"s256:O36Spd-KP9HAcLLOp0UaZG","source":{"human_url":"https://example.com/changelog/"}}],"etag":"s256:fpSlCmakEQv0znY9EWMYnO"}